{
  "$schema": "../../block.schema.json",
  "id": "hero-full",
  "version": "1.0.0",
  "title": "Full-bleed photo hero",
  "summary": "The page's opening statement over one strong photo: eyebrow, title, a short lede and up to two actions. Use for a home page with a photo that carries the place. Avoid when no business-own or licensed photo exists (use a text hero instead).",
  "category": "hero",
  "headingLevel": 1,
  "placement": { "position": "first", "maxPerPage": 1, "notAdjacentTo": ["cta-banner"] },
  "tone": { "default": "media", "locked": true },
  "slots": ["backdrop", "content"],
  "space": "l",
  "variants": ["photo", "video"],
  "props": {
    "type": "object",
    "additionalProperties": false,
    "required": ["title", "image"],
    "properties": {
      "variant": { "enum": ["photo", "video"] },
      "eyebrow": { "type": "string", "maxLength": 48 },
      "title": { "type": "string", "minLength": 3, "maxLength": 60 },
      "lede": { "type": "string", "maxLength": 180 },
      "image": { "type": "string", "pattern": "^[a-z][a-z0-9-]*$", "maxLength": 60 },
      "focal": { "type": "string", "pattern": "^\\d{1,3}% \\d{1,3}%$", "maxLength": 9 },
      "actions": {
        "type": "array",
        "maxItems": 2,
        "items": {
          "type": "object",
          "additionalProperties": false,
          "required": ["label", "href"],
          "properties": {
            "label": { "type": "string", "minLength": 2, "maxLength": 28 },
            "href": { "type": "string", "maxLength": 200 },
            "kind": { "enum": ["primary", "ghost"] }
          }
        }
      }
    }
  },
  "assetProps": ["image"],
  "linkProps": ["actions[].href"],
  "media": [{ "prop": "image", "ratio": "16 / 9", "slot": "full", "priority": true }],
  "schemaOrg": [],
  "a11y": [
    "Renders the page's only h1; the photo is decorative (alt=\"\") because the copy states what matters.",
    "Copy sits on a scrim anchored to the text, measured by the photo-contrast method at every device class.",
    "A video variant pauses under prefers-reduced-motion and has a visible pause button."
  ],
  "perf": { "clientJs": "none", "lcpCandidate": true },
  "truth": [
    "Never a photo of another business, and never a stock photo presented as this place.",
    "The founding year and any claim in the eyebrow come from the business's own records."
  ]
}
